Title,IMDBRating,IMDBRatingCount,ReleaseDate,RunTime,UserCount,CriticCount,Metascore,Budget,Opening,GrossUSA,GrossIntl,Country,Awards,Genres,MPAA,ProdCo,Stars,Noms,Wins,ActNoms,ActWins,ActAwards,ActCreds,ReleaseMonth,ReleaseYear,Comps
The Darkest Hour (2011),4.9,53623,2011-12-25,89.0,222.0,196.0,18.0,30000000.0,3000000.0,21426805.0,64626786.0,USA,1.0,"Action, Adventure, Horror, Sci-Fi, Thriller",PG-13,"Summit Entertainment, Regency Enterprises, Bazelevs Production","Emile Hirsch, Olivia Thirlby, Max Minghella",1.0,0.0,12.0,3.333333333333333,15.333333333333336,64.33333333333333,12.0,2011.0,32.0
Abduction (2011),5.1,70190,2011-09-23,106.0,180.0,177.0,25.0,35000000.0,10925253.0,28087155.0,86648359.0,USA,5.0,"Action, Mystery, Thriller",PG-13,"Lionsgate, Other, Vertigo Entertainment","Taylor Lautner, Lily Collins, Alfred Molina",3.0,2.0,29.66666666666667,12.0,41.66666666666666,152.33333333333334,9.0,2011.0,56.0
Young Adult (2011),6.3,70331,2011-12-16,94.0,211.0,332.0,71.0,12000000.0,310263.0,16311571.0,22939027.0,USA,35.0,"Comedy, Drama",R,"Paramount Pictures, Other, Indian Paintbrush","Charlize Theron, Patrick Wilson, Patton Oswalt",32.0,3.0,46.0,22.33333333333333,68.33333333333333,273.0,12.0,2011.0,32.0
The Inbetweeners Movie (2011),6.8,70377,2011-08-17,97.0,127.0,101.0,44.0,4613141.918697987,35955.0,36000.0,88025781.0,UK,6.0,Comedy,R,"Film4, Other, Other","James Buckley, Blake Harrison, Joe Thomas",4.0,2.0,1.5,0.0,1.5,53.0,8.0,2011.0,30.0
The Artist (2011),7.9,210238,2012-01-20,100.0,600.0,579.0,89.0,15000000.0,204878.0,44671682.0,133432856.0,France,338.0,"Comedy, Drama, Romance",PG-13,"Other, Other, Other","Jean Dujardin, Bérénice Bejo, John Goodman",188.0,150.0,45.0,22.0,67.0,206.66666666666663,1.0,2012.0,38.0
Your Highness (2011),5.5,90935,2011-04-08,102.0,281.0,208.0,31.0,49900000.0,9360020.0,21596445.0,24856478.0,USA,4.0,"Adventure, Comedy, Fantasy",R,"Universal Pictures, Other","Danny McBride, Natalie Portman, James Franco",3.0,1.0,91.33333333333331,43.66666666666666,135.0,293.3333333333333,4.0,2011.0,49.0
J. Edgar (2011),6.6,112448,2011-11-11,137.0,288.0,399.0,59.0,35000000.0,11217324.0,37306030.0,84606030.0,USA,22.0,"Biography, Crime, Drama, History, Romance",R,"Imagine Entertainment, Malpaso Productions, Other","Leonardo DiCaprio, Armie Hammer, Naomi Watts",17.0,5.0,111.33333333333331,53.33333333333334,164.66666666666666,227.66666666666663,11.0,2011.0,42.0
Puss in Boots (2011),6.7,127371,2011-10-28,90.0,145.0,248.0,65.0,130000000.0,34077439.0,149260504.0,554987477.0,USA,52.0,"Animation, Action, Adventure, Comedy, Family, Fantasy",PG,DreamWorks Animation,"Antonio Banderas, Salma Hayek, Zach Galifianakis",43.0,9.0,39.0,25.66666666666667,64.66666666666667,325.6666666666667,10.0,2011.0,48.0
New Year's Eve (2011),5.7,73602,2011-12-09,113.0,139.0,201.0,22.0,56000000.0,13019180.0,54544638.0,142044638.0,USA,10.0,"Comedy, Romance",PG-13,"New Line Cinema, Other, Other","Sarah Jessica Parker, Jessica Biel, Ashton Kutcher",8.0,2.0,36.333333333333336,17.333333333333332,53.66666666666666,250.33333333333331,12.0,2011.0,32.0
My Week with Marilyn (2011),7.0,77336,2011-12-23,99.0,224.0,389.0,65.0,8435459.508476319,1750507.0,14600347.0,35057696.0,UK,80.0,"Biography, Drama",R,"Weinstein Company, BBC Films, Other","Michelle Williams, Eddie Redmayne, Kenneth Branagh",61.0,19.0,88.66666666666669,31.0,119.66666666666669,198.0,12.0,2011.0,32.0
Haywire (2011),5.8,77005,2012-01-20,93.0,407.0,395.0,67.0,23000000.0,8425370.0,18942396.0,33372606.0,Ireland,7.0,"Action, Drama, Thriller",R,"Relativity Media, Irish Film Board","Gina Carano, Ewan McGregor, Michael Fassbender",7.0,0.0,63.66666666666666,34.666666666666664,98.33333333333331,182.66666666666663,1.0,2012.0,38.0
Extremely Loud & Incredibly Close (2011),6.9,90403,2012-01-20,129.0,358.0,285.0,46.0,40000000.0,110775.0,31847881.0,55247881.0,USA,33.0,"Adventure, Drama, Mystery",PG-13,"Warner Bros., Scott Rudin Productions, Paramount Pictures","Thomas Horn, Tom Hanks, Sandra Bullock",25.0,8.0,129.5,79.5,209.0,491.0,1.0,2012.0,38.0
Jack and Jill (2011),3.4,67676,2011-11-11,91.0,293.0,156.0,23.0,79000000.0,25003575.0,74158157.0,150519217.0,USA,19.0,Comedy,PG,"Columbia Pictures, Happy Madison Productions, Other","Adam Sandler, Katie Holmes, Al Pacino",5.0,14.0,53.66666666666666,34.333333333333336,88.0,303.6666666666667,11.0,2011.0,42.0
Killer Elite (2011),6.5,114080,2011-09-23,116.0,164.0,191.0,44.0,70000000.0,9300000.0,25124986.0,65409046.0,UK,9.0,"Action, Crime, Thriller",R,"Other, Other, Other","Jason Statham, Clive Owen, Robert De Niro",7.0,2.0,46.0,25.33333333333333,71.33333333333333,278.6666666666667,9.0,2011.0,56.0
Take Shelter (2011),7.4,79637,2011-11-10,121.0,235.0,330.0,85.0,5000000.0,52041.0,1729969.0,3099314.0,USA,78.0,"Drama, Thriller",R,"Other, Other, Other","Michael Shannon, Jessica Chastain, Shea Whigham",36.0,42.0,68.0,39.333333333333336,107.33333333333331,137.33333333333334,11.0,2011.0,42.0
Larry Crowne (2011),6.1,55970,2011-07-01,98.0,192.0,219.0,41.0,30000000.0,13006875.0,35608245.0,72008245.0,USA,3.0,"Comedy, Drama, Romance",PG-13,"Universal Pictures, Other, StudioCanal","Tom Hanks, Julia Roberts, Sarah Mahoney",3.0,0.0,122.5,71.0,193.5,474.0,7.0,2011.0,42.0
The Best Exotic Marigold Hotel (2011),7.3,82624,2012-05-25,124.0,272.0,262.0,62.0,10000000.0,737051.0,46412041.0,136836156.0,UK,26.0,"Comedy, Drama, Romance",PG-13,Other,"Judi Dench, Bill Nighy, Maggie Smith",22.0,4.0,98.66666666666669,40.66666666666666,139.33333333333334,260.0,5.0,2012.0,38.0
The Rite (2011),6.0,82758,2011-01-28,114.0,205.0,268.0,38.0,37000000.0,14789393.0,33047633.0,97143987.0,USA,6.0,"Drama, Horror, Mystery, Thriller",PG-13,"New Line Cinema, Contrafilm, Other","Colin ODonoghue, Anthony Hopkins, Ciarán Hinds",5.0,1.0,36.0,28.5,64.5,255.5,1.0,2011.0,41.0
Jin ling shi san chai (2011),7.6,43654,2011-12-16,146.0,139.0,137.0,46.0,94000000.0,48558.0,9213.0,95000000.0,China,18.0,"Drama, History, Romance, War",R,"Other, Other, Other","Christian Bale, Ni Ni, Xinyi Zhang",13.0,5.0,82.0,66.0,148.0,203.0,12.0,2011.0,32.0
Anonymous (2011),6.9,36964,2011-10-28,130.0,140.0,289.0,50.0,30000000.0,1012768.0,4463292.0,15395087.0,UK,16.0,"Drama, Thriller",PG-13,"Columbia Pictures, Relativity Media, Centropolis Entertainment","Rhys Ifans, Vanessa Redgrave, David Thewlis",9.0,7.0,31.0,19.0,50.0,188.0,10.0,2011.0,48.0
The Eagle (2011),6.2,59158,2011-02-11,114.0,197.0,216.0,55.0,25000000.0,8684464.0,19490041.0,27122040.0,UK,1.0,"Action, Adventure, Drama, History",PG-13,"Focus Features, Film4, Other","Channing Tatum, Jamie Bell, Donald Sutherland",1.0,0.0,35.333333333333336,18.666666666666668,54.0,225.0,2.0,2011.0,36.0
Carnage (2011),7.2,107171,2011-11-18,80.0,187.0,376.0,61.0,25000000.0,79795.0,2547047.0,27603069.0,France,27.0,"Comedy, Drama",R,"Other, Constantin Film, Other","Jodie Foster, Kate Winslet, Christoph Waltz",20.0,7.0,81.0,75.66666666666667,156.66666666666666,284.3333333333333,11.0,2011.0,42.0
Machine Gun Preacher (2011),6.8,58240,2011-11-02,129.0,128.0,138.0,43.0,30000000.0,45130.0,538690.0,1104633.0,USA,2.0,"Action, Biography, Crime, Drama",R,"Relativity Media, Other, Other","Gerard Butler, Michelle Monaghan, Michael Shannon",2.0,0.0,36.333333333333336,13.666666666666664,50.0,150.66666666666666,11.0,2011.0,42.0
The Iron Lady (2011),6.4,92563,2012-01-13,105.0,372.0,334.0,54.0,13000000.0,220409.0,30017992.0,114956699.0,UK,72.0,"Biography, Drama",PG-13,"Other, Pathé, Film4","Meryl Streep, Jim Broadbent, Richard E. Grant",47.0,25.0,137.33333333333334,67.66666666666667,205.0,327.6666666666667,1.0,2012.0,38.0
W.E. (2011),6.3,10932,2012-01-20,119.0,69.0,121.0,37.0,15000000.0,47074.0,583455.0,2042203.0,UK,9.0,"Drama, History, Romance",R,"Other, IM Global","Abbie Cornish, James DArcy, Andrea Riseborough",5.0,4.0,18.0,16.0,34.0,70.0,1.0,2012.0,38.0
Alvin and the Chipmunks: Chipwrecked (2011),4.4,26388,2011-12-16,87.0,60.0,89.0,24.0,75000000.0,23244744.0,133110742.0,342695435.0,USA,3.0,"Animation, Adventure, Comedy, Family, Fantasy, Music",G,"Fox 2000 Pictures, Regency Enterprises, Other","Justin Long, Matthew Gray Gubler, Jesse McCartney",1.0,2.0,7.666666666666668,4.666666666666667,12.333333333333336,168.33333333333334,12.0,2011.0,32.0
This Must Be the Place (2011),6.7,29290,2011-08-24,118.0,79.0,201.0,61.0,29122831.950775426,7754.0,142242.0,11790979.0,Italy,34.0,"Comedy, Drama",R,"Other, Other, Medusa Film","Sean Penn, Frances McDormand, Judd Hirsch",15.0,19.0,94.5,80.5,175.0,213.0,8.0,2011.0,30.0
Dolphin Tale (2011),6.9,19880,2011-09-23,113.0,90.0,130.0,64.0,37000000.0,19152401.0,72286779.0,95404397.0,Canada,6.0,"Drama, Family",PG,"Alcon Entertainment, Other, Other","Morgan Freeman, Ashley Judd, Harry Connick Jr.",4.0,2.0,34.0,22.33333333333333,56.33333333333334,315.0,9.0,2011.0,56.0
Arthur (2011),5.7,47970,2011-04-08,110.0,166.0,178.0,36.0,40000000.0,12222756.0,33035397.0,45735397.0,USA,9.0,"Comedy, Romance",PG-13,"Warner Bros., Other, Other, Other, BenderSpink","Russell Brand, Helen Mirren, Jennifer Garner",6.0,3.0,62.66666666666666,46.0,108.66666666666669,309.0,4.0,2011.0,49.0
The Dilemma (2011),5.3,47033,2011-01-14,111.0,145.0,183.0,46.0,70000000.0,17816230.0,48475290.0,69721966.0,USA,1.0,"Comedy, Drama",PG-13,"Universal Pictures, Imagine Entertainment, Spyglass Entertainment","Vince Vaughn, Kevin James, Winona Ryder",1.0,0.0,25.66666666666667,9.0,34.666666666666664,196.66666666666663,1.0,2011.0,41.0
"Big Mommas: Like Father, Like Son (2011)",4.4,22403,2011-02-18,107.0,49.0,86.0,22.0,32000000.0,19000000.0,37915414.0,82686066.0,USA,4.0,"Action, Comedy, Crime",PG-13,"Regency Enterprises, New Regency Pictures, Other","Martin Lawrence, Brandon T. Jackson, Jessica Lucas",4.0,0.0,4.666666666666667,2.0,6.666666666666668,97.0,2.0,2011.0,36.0
Albert Nobbs (2011),6.7,21505,2012-02-22,113.0,100.0,223.0,57.0,8000000.0,696166.0,3014696.0,7532259.0,UK,60.0,"Drama, Romance",R,"Mockingbird Pictures, Other, Other","Glenn Close, Mia Wasikowska, Aaron Taylor-Johnson",41.0,19.0,48.66666666666666,20.0,68.66666666666667,175.66666666666663,2.0,2012.0,29.0
From Up on Poppy Hill (2011),7.5,24301,2011-07-16,91.0,53.0,131.0,71.0,22000000.0,57585.0,1002895.0,61037844.0,Japan,17.0,"Animation, Drama, Family, Romance",PG,"Other, Nippon Television Network (NTV), Dentsu","Sarah Bolger, Chris Noth, Anton Yelchin",11.0,6.0,16.5,6.0,22.5,91.0,7.0,2011.0,42.0
Rundskop (2011),7.4,19862,2011-02-02,129.0,48.0,240.0,68.0,2329826.556062034,32267.0,151840.0,362607.0,Belgium,40.0,"Crime, Drama",R,"Other, Other, Other","Matthias Schoenaerts, Jeroen Perceval, Jeanne Dandoy",19.0,21.0,12.0,15.0,27.0,79.0,2.0,2011.0,36.0
Madea's Big Happy Family (2011),4.6,6730,2011-04-22,106.0,35.0,31.0,45.0,25000000.0,25068677.0,53345287.0,54161287.0,USA,2.0,"Comedy, Drama",PG-13,Tyler Perry Company,"Tyler Perry, Loretta Devine, Shad Moss",1.0,1.0,23.33333333333333,9.0,32.333333333333336,243.33333333333331,4.0,2011.0,49.0
Intruders (2011),5.4,18929,2011-10-07,100.0,74.0,121.0,45.0,13000000.0,40746.0,69136.0,3012210.0,USA,6.0,"Fantasy, Horror, Thriller",R,"Antena 3 Films, Other, Canal+ España","Clive Owen, Carice van Houten, Izán Corchero",5.0,1.0,26.5,20.5,47.0,126.0,10.0,2011.0,48.0
Arthur Christmas (2011),7.1,42384,2011-11-23,97.0,85.0,197.0,69.0,100000000.0,12068931.0,46462469.0,147419472.0,UK,26.0,"Animation, Adventure, Comedy, Family, Fantasy",PG,"Other, Columbia Pictures, Sony Pictures Animation","James McAvoy, Jim Broadbent, Bill Nighy",23.0,3.0,38.0,18.33333333333333,56.33333333333334,217.66666666666663,11.0,2011.0,42.0
The Son of No One (2011),5.1,15359,2011-07-09,90.0,47.0,59.0,36.0,15000000.0,18015.0,28870.0,1335012.0,USA,1.0,"Action, Crime, Drama, Thriller",R,"Millennium Films, Millennium Films, Other","Channing Tatum, Al Pacino, Juliette Binoche",1.0,0.0,59.33333333333334,33.333333333333336,92.66666666666669,227.66666666666663,7.0,2011.0,42.0
Ra.One (2011),4.8,34209,2011-10-26,156.0,311.0,56.0,60.0,24000000.0,1654023.0,2511689.0,35911689.0,India,16.0,"Action, Adventure, Sci-Fi",NOT RATED,"Red Chillies Entertainment, Eros International, Other","Shah Rukh Khan, Arjun Rampal, Kareena Kapoor",6.0,10.0,30.33333333333333,27.33333333333333,57.66666666666666,123.33333333333331,10.0,2011.0,48.0
Long men fei jia (2011),6.0,7057,2011-12-15,122.0,23.0,73.0,57.0,35000000.0,95452.0,170276.0,89375320.0,China,40.0,"Action, Adventure",R,"Other, Other, Other","Jet Li, Xun Zhou, Kun Chen",29.0,11.0,25.5,14.5,40.0,88.0,12.0,2011.0,32.0
Xin hai ge ming (2011),5.9,5332,2011-09-23,121.0,30.0,65.0,37.0,18000000.0,55850.0,127437.0,79914300.0,China,11.0,"Action, Adventure, Drama, History, War",R,"Other, Other, Other","Jackie Chan, Winston Chao, Bingbing Li",7.0,4.0,28.5,22.5,51.0,298.0,9.0,2011.0,56.0
Snow Flower and the Secret Fan (2011),6.1,3313,2011-06-24,104.0,25.0,55.0,42.0,6000000.0,134005.0,1348205.0,11348205.0,China,2.0,"Drama, History",PG-13,Other,"Bingbing Li, Ji-hyun Jun, Vivian Wu",1.0,1.0,8.0,4.666666666666667,12.666666666666664,48.0,6.0,2011.0,41.0
The Avengers (2012),8.1,1114349,2012-05-04,143.0,1773.0,717.0,69.0,220000000.0,207438708.0,623357910.0,1519557910.0,USA,117.0,"Action, Adventure, Sci-Fi",PG-13,"Marvel Studios, Paramount Pictures","Robert Downey Jr., Chris Evans, Scarlett Johansson",79.0,38.0,93.66666666666669,27.0,120.66666666666669,267.6666666666667,5.0,2012.0,38.0
Hotel Transylvania (2012),7.1,190121,2012-09-28,91.0,186.0,265.0,47.0,85000000.0,42522194.0,148313048.0,358375603.0,USA,17.0,"Animation, Comedy, Family, Fantasy, Horror",PG,"Columbia Pictures, Sony Pictures Animation","Adam Sandler, Kevin James, Andy Samberg",15.0,2.0,41.0,20.0,61.0,317.6666666666667,9.0,2012.0,50.0
The Dark Knight Rises (2012),8.4,1316106,2012-07-20,164.0,2786.0,826.0,78.0,250000000.0,160887295.0,448139099.0,1084939099.0,UK,140.0,"Action, Thriller",PG-13,"Warner Bros., Legendary Entertainment, DC Entertainment","Christian Bale, Tom Hardy, Anne Hathaway",102.0,38.0,87.66666666666669,49.0,136.66666666666666,195.66666666666663,7.0,2012.0,36.0
The Twilight Saga: Breaking Dawn - Part 2 (2012),5.5,204677,2012-11-16,115.0,344.0,321.0,52.0,120000000.0,141067634.0,292298923.0,832660037.0,USA,35.0,"Adventure, Drama, Fantasy, Romance",PG-13,"Summit Entertainment, Temple Hill Entertainment, Other","Kristen Stewart, Robert Pattinson, Taylor Lautner",14.0,21.0,49.0,36.333333333333336,85.33333333333333,149.0,11.0,2012.0,46.0
Django Unchained (2012),8.4,1137311,2012-12-25,165.0,1289.0,808.0,81.0,100000000.0,30688000.0,162805434.0,425368238.0,USA,210.0,"Drama, Western",R,"Weinstein Company, Columbia Pictures","Jamie Foxx, Christoph Waltz, Leonardo DiCaprio",151.0,59.0,109.33333333333331,76.66666666666667,186.0,345.66666666666674,12.0,2012.0,24.0
The Hunger Games (2012),7.2,770088,2012-03-23,142.0,1992.0,679.0,68.0,78000000.0,152535747.0,408010692.0,694394724.0,USA,81.0,"Adventure, Sci-Fi, Thriller",PG-13,"Lionsgate, Other","Jennifer Lawrence, Josh Hutcherson, Liam Hemsworth",48.0,33.0,71.66666666666667,46.66666666666666,118.33333333333331,155.0,3.0,2012.0,50.0
Les Misérables (2012),7.6,273327,2012-12-25,158.0,886.0,493.0,63.0,61000000.0,28027000.0,148809770.0,441809770.0,UK,259.0,"Drama, History, Musical, Romance, War",PG-13,"Working Title Films, Other, Universal Pictures","Hugh Jackman, Russell Crowe, Anne Hathaway",172.0,87.0,87.33333333333331,42.333333333333336,129.66666666666666,331.3333333333333,12.0,2012.0,24.0
Wreck-It Ralph (2012),7.7,313195,2012-11-02,101.0,372.0,381.0,72.0,165000000.0,49038712.0,189422889.0,471222889.0,USA,75.0,"Animation, Adventure, Comedy, Family, Fantasy",PG,"Walt Disney Animation Studios, Walt Disney Pictures","John C. Reilly, Jack McBrayer, Jane Lynch",42.0,33.0,31.0,10.0,41.0,189.5,11.0,2012.0,46.0
The Hobbit: An Unexpected Journey (2012),7.9,697820,2012-12-14,169.0,1402.0,652.0,58.0,180000000.0,84617303.0,303003568.0,1021103568.0,USA,85.0,"Adventure, Family, Fantasy",PG-13,"New Line Cinema, Metro-Goldwyn-Mayer (MGM), WingNut Films","Martin Freeman, Ian McKellen, Richard Armitage",75.0,10.0,33.0,21.33333333333333,54.33333333333334,228.66666666666663,12.0,2012.0,24.0
Skyfall (2012),7.8,572188,2012-11-09,143.0,1527.0,750.0,81.0,200000000.0,88364714.0,304360277.0,1108561013.0,UK,186.0,"Action, Adventure, Thriller",PG-13,"Other, Other, Columbia Pictures","Daniel Craig, Javier Bardem, Naomie Harris",119.0,67.0,55.33333333333334,45.0,100.33333333333331,215.66666666666663,11.0,2012.0,46.0
Brave (2012),7.1,317228,2012-06-22,93.0,450.0,494.0,69.0,185000000.0,66323594.0,237283207.0,538983207.0,USA,67.0,"Animation, Adventure, Comedy, Family, Fantasy",PG,"Walt Disney Pictures, Pixar Animation Studios","Kelly Macdonald, Billy Connolly, Emma Thompson",48.0,19.0,49.33333333333334,27.0,76.33333333333333,217.33333333333331,6.0,2012.0,33.0
Jack Reacher (2012),7.0,268217,2012-12-21,130.0,487.0,404.0,50.0,60000000.0,15210156.0,80070736.0,218340595.0,USA,6.0,"Action, Crime, Mystery, Thriller",PG-13,"Paramount Pictures, Skydance Media, Mutual Film Company","Tom Cruise, Rosamund Pike, Richard Jenkins",5.0,1.0,63.66666666666666,31.66666666666667,95.33333333333331,271.3333333333333,12.0,2012.0,24.0
The Cabin in the Woods (2012),7.0,319305,2012-04-13,95.0,1044.0,647.0,72.0,30000000.0,14743614.0,42073277.0,70768144.0,USA,53.0,"Comedy, Horror",R,"Lionsgate, Other, Metro-Goldwyn-Mayer (MGM)","Kristen Connolly, Chris Hemsworth, Anna Hutchison",33.0,20.0,16.5,5.5,22.0,98.5,4.0,2012.0,39.0
Prometheus (2012),7.0,520490,2012-06-08,124.0,2441.0,804.0,64.0,130000000.0,51050101.0,126477084.0,403354469.0,USA,53.0,"Adventure, Mystery, Sci-Fi",R,"Twentieth Century Fox, Dune Entertainment, Scott Free Productions","Noomi Rapace, Logan Marshall-Green, Michael Fassbender",47.0,6.0,53.66666666666666,29.66666666666667,83.33333333333333,97.33333333333331,6.0,2012.0,33.0
Pitch Perfect (2012),7.2,244019,2012-10-05,112.0,284.0,230.0,66.0,17000000.0,5149433.0,65001093.0,113042075.0,USA,27.0,"Comedy, Music, Romance",PG-13,"Other, Gold Circle Films","Anna Kendrick, Brittany Snow, Rebel Wilson",20.0,7.0,33.333333333333336,9.0,42.333333333333336,142.0,10.0,2012.0,47.0
Zero Dark Thirty (2012),7.4,240148,2013-01-11,157.0,673.0,569.0,95.0,40000000.0,417150.0,95720716.0,132820716.0,USA,259.0,"Drama, Thriller",R,"Columbia Pictures, Annapurna Pictures, Other","Jessica Chastain, Joel Edgerton, Chris Pratt",171.0,88.0,62.66666666666666,35.333333333333336,98.0,188.33333333333331,1.0,2013.0,38.0
Cloud Atlas (2012),7.5,315740,2012-10-26,172.0,876.0,509.0,55.0,102000000.0,9612247.0,27108272.0,130482868.0,Germany,92.0,"Action, Drama, Mystery, Sci-Fi",R,"Other, X-Filme Creative Pool, Other","Tom Hanks, Halle Berry, Hugh Grant",76.0,16.0,87.0,48.0,135.0,440.33333333333326,10.0,2012.0,47.0
Snow White and the Huntsman (2012),6.1,250385,2012-06-01,127.0,726.0,423.0,57.0,170000000.0,56217700.0,155332381.0,396592829.0,USA,46.0,"Action, Adventure, Drama, Fantasy",PG-13,"Other, Universal Pictures","Kristen Stewart, Chris Hemsworth, Charlize Theron",33.0,13.0,66.66666666666667,39.333333333333336,106.0,218.33333333333331,6.0,2012.0,33.0
The Amazing Spider-Man (2012),7.0,502843,2012-07-03,136.0,1267.0,617.0,66.0,230000000.0,62004688.0,262030663.0,757930663.0,USA,33.0,"Action, Adventure, Sci-Fi",PG-13,"Columbia Pictures, Marvel Entertainment, Other","Andrew Garfield, Emma Stone, Rhys Ifans",31.0,2.0,67.33333333333333,26.0,93.33333333333331,143.0,7.0,2012.0,36.0
The Impossible (2012),7.6,168121,2013-01-04,114.0,345.0,376.0,73.0,45000000.0,143818.0,19019882.0,180274123.0,Spain,95.0,"Drama, History, Thriller",PG-13,"Other, Summit Entertainment, Other","Naomi Watts, Ewan McGregor, Tom Holland",68.0,27.0,50.0,32.333333333333336,82.33333333333333,214.33333333333331,1.0,2013.0,38.0
Lincoln (2012),7.4,220163,2012-11-16,150.0,750.0,546.0,86.0,65000000.0,944308.0,182207973.0,275293450.0,USA,352.0,"Biography, Drama, History, War",PG-13,"DreamWorks, Twentieth Century Fox, Reliance Entertainment","Daniel Day-Lewis, Sally Field, David Strathairn",242.0,110.0,69.66666666666667,66.33333333333333,136.0,189.33333333333331,11.0,2012.0,46.0
Journey 2: The Mysterious Island (2012),5.8,78639,2012-02-10,94.0,146.0,177.0,41.0,79000000.0,27335363.0,103860290.0,335260290.0,USA,11.0,"Action, Adventure, Comedy, Family, Fantasy, Sci-Fi",PG,"New Line Cinema, Contrafilm, Walden Media","Josh Hutcherson, Dwayne Johnson, Michael Caine",4.0,7.0,45.66666666666666,22.66666666666667,68.33333333333333,413.0,2.0,2012.0,29.0
Moonrise Kingdom (2012),7.8,276490,2012-06-29,94.0,408.0,493.0,84.0,16000000.0,522996.0,45512466.0,68263166.0,USA,157.0,"Adventure, Comedy, Drama, Romance",PG-13,"Indian Paintbrush, Other, Other","Jared Gilman, Kara Hayward, Bruce Willis",119.0,38.0,37.0,22.0,59.0,419.0,6.0,2012.0,33.0
Looper (2012),7.4,479498,2012-09-28,113.0,708.0,597.0,84.0,30000000.0,20801552.0,66486205.0,176506819.0,USA,61.0,"Action, Crime, Drama, Sci-Fi, Thriller",R,"Endgame Entertainment, Other, FilmDistrict","Joseph Gordon-Levitt, Bruce Willis, Emily Blunt",45.0,16.0,56.33333333333334,20.0,76.33333333333333,284.3333333333333,9.0,2012.0,50.0
Silver Linings Playbook (2012),7.8,596592,2012-12-25,122.0,736.0,534.0,81.0,21000000.0,443003.0,132092958.0,236412453.0,USA,234.0,"Comedy, Drama, Romance",R,Weinstein Company,"Bradley Cooper, Jennifer Lawrence, Robert De Niro",145.0,89.0,113.33333333333331,66.0,179.33333333333337,323.6666666666667,12.0,2012.0,24.0
21 Jump Street (2012),7.2,458325,2012-03-16,109.0,365.0,376.0,69.0,42000000.0,36302612.0,138447667.0,201585328.0,USA,31.0,"Action, Comedy, Crime",R,"Columbia Pictures, Metro-Goldwyn-Mayer (MGM), Relativity Media","Jonah Hill, Channing Tatum, Ice Cube",20.0,11.0,46.33333333333334,12.0,58.33333333333334,283.3333333333333,3.0,2012.0,50.0
This Is 40 (2012),6.2,113398,2012-12-21,134.0,261.0,288.0,59.0,35000000.0,12030690.0,67544505.0,88058786.0,USA,13.0,"Comedy, Romance",R,"Apatow Productions, Other","Paul Rudd, Leslie Mann, Maude Apatow",11.0,2.0,12.0,5.0,17.0,201.5,12.0,2012.0,24.0
Ted (2012),7.0,519008,2012-06-29,106.0,636.0,455.0,62.0,50000000.0,54415205.0,218815487.0,549368315.0,USA,41.0,"Comedy, Fantasy",R,"Universal Pictures, Media Rights Capital (MRC), Other","Mark Wahlberg, Mila Kunis, Seth MacFarlane",28.0,13.0,60.33333333333334,18.33333333333333,78.66666666666667,313.3333333333333,6.0,2012.0,33.0
American Reunion (2012),6.7,185998,2012-04-06,113.0,180.0,292.0,49.0,50000000.0,21514080.0,57011521.0,234989584.0,USA,5.0,Comedy,R,"Universal Pictures, Other, Relativity Media","Jason Biggs, Alyson Hannigan, Seann William Scott",4.0,1.0,13.0,4.666666666666667,17.666666666666668,146.66666666666666,4.0,2012.0,39.0
Magic Mike (2012),6.1,119602,2012-06-29,110.0,296.0,326.0,72.0,7000000.0,39127170.0,113721571.0,167221571.0,USA,23.0,"Comedy, Drama",R,"Other, Other, Other","Channing Tatum, Alex Pettyfer, Olivia Munn",14.0,9.0,21.0,8.333333333333334,29.33333333333333,139.0,6.0,2012.0,33.0
Jagten (2012),8.3,222028,2013-01-10,115.0,308.0,360.0,77.0,3800000.0,43045.0,687185.0,18309793.0,Denmark,103.0,Drama,R,"Danmarks Radio (DR), Det Danske Filminstitut, Eurimages","Mads Mikkelsen, Thomas Bo Larsen, Annika Wedderkopp",67.0,36.0,34.0,28.0,62.0,135.0,1.0,2013.0,38.0
The Lorax (2012),6.4,86392,2012-03-02,86.0,208.0,239.0,46.0,70000000.0,70217070.0,214030500.0,348840316.0,USA,11.0,"Animation, Adventure, Comedy, Drama, Family, Fantasy, Musical",PG,"Universal Pictures, Other","Zac Efron, Taylor Swift, Danny DeVito",8.0,3.0,35.0,20.0,55.0,363.0,3.0,2012.0,50.0
Argo (2012),7.7,512743,2012-10-12,120.0,726.0,653.0,86.0,44500000.0,19458109.0,136025503.0,232325503.0,USA,249.0,"Biography, Drama, Thriller",R,"Warner Bros., GK Films, Other","Ben Affleck, Bryan Cranston, John Goodman",152.0,97.0,88.33333333333331,51.33333333333334,139.66666666666666,384.33333333333326,10.0,2012.0,47.0
The Dictator (2012),6.4,238631,2012-05-16,83.0,320.0,314.0,58.0,65000000.0,17435092.0,59650222.0,179379533.0,USA,2.0,Comedy,R,"Paramount Pictures, Other","Sacha Baron Cohen, Anna Faris, John C. Reilly",1.0,1.0,33.666666666666664,14.0,47.66666666666666,186.0,5.0,2012.0,38.0
John Carter (2012),6.6,231171,2012-03-09,132.0,778.0,468.0,51.0,250000000.0,30180188.0,73078100.0,284139100.0,USA,10.0,"Action, Adventure, Sci-Fi",PG-13,"Walt Disney Pictures, Other","Taylor Kitsch, Lynn Collins, Willem Dafoe",8.0,2.0,25.66666666666667,22.0,47.66666666666666,153.66666666666666,3.0,2012.0,50.0
Lawless (2012),7.3,206221,2012-08-29,116.0,289.0,359.0,58.0,26000000.0,10001566.0,37400127.0,53676580.0,USA,9.0,"Crime, Drama",R,"Weinstein Company, Other, Other","Tom Hardy, Shia LaBeouf, Guy Pearce",8.0,1.0,52.66666666666666,13.0,65.66666666666667,162.0,8.0,2012.0,46.0
Battleship (2012),5.8,219060,2012-05-18,131.0,784.0,385.0,41.0,209000000.0,25534825.0,65422625.0,303025485.0,USA,19.0,"Action, Adventure, Sci-Fi, Thriller",PG-13,"Universal Pictures, Other, Other","Alexander Skarsgård, Brooklyn Decker, Liam Neeson",15.0,4.0,27.0,16.5,43.5,261.0,5.0,2012.0,38.0
Savages (2012),6.5,112063,2012-07-06,131.0,280.0,342.0,59.0,45000000.0,16016910.0,47382068.0,82966152.0,USA,6.0,"Crime, Drama, Thriller",R,"Other, Other, Relativity Media","Aaron Taylor-Johnson, Taylor Kitsch, Blake Lively",6.0,0.0,16.0,4.666666666666667,20.666666666666668,92.66666666666669,7.0,2012.0,36.0
Total Recall (2012),6.3,221112,2012-08-03,118.0,559.0,406.0,43.0,125000000.0,25577758.0,58877969.0,198467168.0,USA,6.0,"Action, Adventure, Mystery, Sci-Fi, Thriller",PG-13,"Other, Original Film, Other","Colin Farrell, Bokeem Woodbine, Bryan Cranston",5.0,1.0,49.0,22.0,71.0,241.66666666666663,8.0,2012.0,46.0
Sinister (2012),6.8,186913,2012-10-12,110.0,570.0,421.0,53.0,3000000.0,18007634.0,48086903.0,87727807.0,USA,16.0,"Horror, Mystery, Thriller",R,"Other, IM Global, Blumhouse Productions","Ethan Hawke, Juliet Rylance, James Ransone",13.0,3.0,56.5,13.0,69.5,158.5,10.0,2012.0,47.0
