Title,IMDBRating,IMDBRatingCount,ReleaseDate,RunTime,UserCount,CriticCount,Metascore,Budget,Opening,GrossUSA,GrossIntl,Country,Awards,Genres,MPAA,ProdCo,Stars,Noms,Wins,ActNoms,ActWins,ActAwards,ActCreds,ReleaseMonth,ReleaseYear,Comps
Hot Fuzz (2007),7.9,402951,2007-04-20,121.0,725.0,293.0,81.0,10544324.385595398,5848464.0,23637265.0,80573774.0,UK,11.0,"Action, Comedy",R,"StudioCanal, Working Title Films, Other","Simon Pegg, Nick Frost, Martin Freeman",9.0,2.0,18.0,7.0,25.0,230.66666666666663,4.0,2007.0,55.0
Stardust (2007),7.7,231142,2007-08-10,127.0,514.0,234.0,66.0,70000000.0,9169779.0,38634938.0,135560026.0,UK,13.0,"Adventure, Family, Fantasy, Romance",PG-13,"Paramount Pictures, Other, Other","Charlie Cox, Claire Danes, Sienna Miller",8.0,5.0,25.33333333333333,15.666666666666664,41.0,121.0,8.0,2007.0,46.0
There Will Be Blood (2007),8.1,439020,2008-01-25,158.0,1162.0,414.0,93.0,25000000.0,302845.0,40222514.0,77208711.0,USA,244.0,Drama,R,"Paramount Vantage, Miramax, Other","Daniel Day-Lewis, Paul Dano, Ciarán Hinds",136.0,108.0,46.66666666666666,57.0,103.66666666666669,112.33333333333331,1.0,2008.0,49.0
Zodiac (2007),7.7,365473,2007-03-02,157.0,636.0,393.0,78.0,65000000.0,13395610.0,33080084.0,84785914.0,USA,69.0,"Crime, Drama, History, Mystery, Thriller",R,"Paramount Pictures, Warner Bros., Phoenix Pictures","Jake Gyllenhaal, Robert Downey Jr., Mark Ruffalo",67.0,2.0,104.66666666666669,33.666666666666664,138.33333333333334,283.3333333333333,3.0,2007.0,49.0
Shooter (2007),7.2,281317,2007-03-23,124.0,354.0,199.0,53.0,61000000.0,14523571.0,47003582.0,95696996.0,USA,2.0,"Action, Crime, Drama, Mystery, Thriller",R,"Paramount Pictures, Di Bonaventura Pictures, Other","Mark Wahlberg, Michael Peña, Rhona Mitra",2.0,0.0,26.0,11.0,37.0,209.66666666666663,3.0,2007.0,49.0
Atonement (2007),7.8,217585,2008-01-11,123.0,602.0,321.0,85.0,30000000.0,796836.0,50927067.0,129266061.0,UK,197.0,"Drama, Mystery, Romance, War",R,"Universal Pictures, StudioCanal, Relativity Media","Keira Knightley, James McAvoy, Brenda Blethyn",146.0,51.0,55.66666666666666,20.666666666666668,76.33333333333333,177.66666666666663,1.0,2008.0,49.0
Hairspray (2007),6.7,108285,2007-07-20,117.0,405.0,210.0,81.0,75000000.0,27476745.0,118871849.0,202548575.0,USA,64.0,"Comedy, Drama, Music, Musical, Romance",PG,"New Line Cinema, Ingenious Film Partners, Other","John Travolta, Queen Latifah, Nikki Blonsky",43.0,21.0,72.0,42.5,114.5,500.0,7.0,2007.0,27.0
Halloween (2007),6.1,96665,2007-08-31,109.0,1093.0,338.0,47.0,15000000.0,30591759.0,58272029.0,80253908.0,USA,4.0,"Fantasy, Horror",R,"Dimension Films, Other, Other","Scout Taylor-Compton, Malcolm McDowell, Tyler Mane",2.0,2.0,3.6666666666666665,4.666666666666667,8.333333333333334,190.33333333333331,8.0,2007.0,46.0
Ghost Rider (2007),5.2,201344,2007-02-16,114.0,689.0,277.0,35.0,110000000.0,52022908.0,115802596.0,228738393.0,USA,10.0,"Action, Fantasy, Horror, Thriller",PG-13,"Columbia Pictures Corporation, Other, Relativity Media","Nicolas Cage, Eva Mendes, Sam Elliott",9.0,1.0,29.0,18.0,47.0,223.33333333333331,2.0,2007.0,36.0
American Gangster (2007),7.8,352812,2007-11-02,157.0,474.0,304.0,76.0,100000000.0,43565135.0,130164645.0,266465037.0,USA,49.0,"Biography, Crime, Drama, Thriller",R,"Universal Pictures, Imagine Entertainment, Relativity Media","Denzel Washington, Russell Crowe, Chiwetel Ejiofor",37.0,12.0,104.33333333333331,57.33333333333334,161.66666666666666,277.0,11.0,2007.0,44.0
Beowulf (2007),6.2,151406,2007-11-16,115.0,510.0,290.0,59.0,150000000.0,27515871.0,82161969.0,196393745.0,USA,20.0,"Animation, Action, Adventure, Fantasy",PG-13,"Paramount Pictures, Other, ImageMovers","Ray Winstone, Crispin Glover, Angelina Jolie",17.0,3.0,43.66666666666666,23.66666666666667,67.33333333333333,238.0,11.0,2007.0,44.0
Sunshine (2007),7.3,211648,2007-07-27,107.0,832.0,265.0,64.0,34269054.25318505,242964.0,3675753.0,32017803.0,UK,19.0,"Adventure, Sci-Fi, Thriller",R,"DNA Films, Ingenious Film Partners, Other","Cillian Murphy, Rose Byrne, Chris Evans",18.0,1.0,32.666666666666664,8.0,40.66666666666666,134.66666666666666,7.0,2007.0,27.0
P.S. I Love You (2007),7.1,185724,2007-12-21,126.0,256.0,130.0,39.0,30000000.0,9283468.0,53695808.0,156835339.0,USA,6.0,"Drama, Romance",PG-13,"Alcon Entertainment, Other, Other","Hilary Swank, Gerard Butler, Harry Connick Jr.",4.0,2.0,20.33333333333333,21.0,41.333333333333336,216.33333333333331,12.0,2007.0,31.0
Pirates of the Caribbean: At World's End (2007),7.1,533164,2007-05-25,169.0,1265.0,318.0,50.0,300000000.0,139802190.0,309420425.0,963420425.0,USA,66.0,"Action, Adventure, Fantasy",PG-13,"Walt Disney Pictures, Jerry Bruckheimer Films, Other","Johnny Depp, Orlando Bloom, Keira Knightley",46.0,20.0,88.33333333333331,43.33333333333334,131.66666666666666,305.6666666666667,5.0,2007.0,33.0
Knocked Up (2007),7.0,321877,2007-06-01,129.0,569.0,248.0,85.0,30000000.0,30690990.0,148768917.0,219076518.0,USA,33.0,"Comedy, Romance",R,"Universal Pictures, Apatow Productions","Seth Rogen, Katherine Heigl, Paul Rudd",25.0,8.0,27.66666666666667,9.333333333333334,37.0,260.0,6.0,2007.0,40.0
Live Free or Die Hard (2007),7.2,360859,2007-06-27,128.0,801.0,359.0,69.0,110000000.0,33369559.0,134529403.0,383531464.0,USA,19.0,"Action, Adventure, Thriller",PG-13,"Twentieth Century Fox, Dune Entertainment, Ingenious Film Partners","Bruce Willis, Justin Long, Timothy Olyphant",16.0,3.0,22.0,9.333333333333334,31.33333333333333,239.0,6.0,2007.0,40.0
I Am Legend (2007),7.2,605617,2007-12-14,101.0,1446.0,327.0,65.0,150000000.0,77211321.0,256386216.0,585349010.0,USA,31.0,"Drama, Horror, Sci-Fi, Thriller",PG-13,"Warner Bros., Village Roadshow Pictures, Other","Will Smith, Alice Braga, Charlie Tahan",22.0,9.0,45.0,23.66666666666667,68.66666666666667,238.0,12.0,2007.0,31.0
Enchanted (2007),7.1,158730,2007-11-21,107.0,405.0,222.0,75.0,85000000.0,34440317.0,127807262.0,340487652.0,USA,63.0,"Animation, Comedy, Family, Fantasy, Musical, Romance",PG,"Walt Disney Pictures, Other, Other","Amy Adams, Susan Sarandon, James Marsden",51.0,12.0,96.0,41.66666666666666,137.66666666666666,310.3333333333333,11.0,2007.0,44.0
Sweeney Todd: The Demon Barber of Fleet Street (2007),7.4,311088,2007-12-21,116.0,791.0,379.0,83.0,50000000.0,13635390.0,52898073.0,152523073.0,USA,109.0,"Drama, Horror, Musical, Thriller",R,"DreamWorks, Warner Bros., Parkes+MacDonald Image Nation","Johnny Depp, Helena Bonham Carter, Alan Rickman",75.0,34.0,87.66666666666669,45.66666666666666,133.33333333333334,290.6666666666667,12.0,2007.0,31.0
Bridge to Terabithia (2007),7.2,125533,2007-02-16,96.0,531.0,183.0,74.0,17000000.0,28536717.0,82272442.0,137587063.0,USA,11.0,"Adventure, Drama, Family, Fantasy",PG,"Walden Media, Other, Other","Josh Hutcherson, AnnaSophia Robb, Zooey Deschanel",5.0,6.0,16.0,11.5,27.5,107.0,2.0,2007.0,36.0
Juno (2007),7.5,452071,2007-12-25,96.0,895.0,381.0,81.0,7500000.0,413869.0,143495265.0,231411584.0,USA,185.0,"Comedy, Drama",PG-13,"Fox Searchlight Pictures, Mandate Pictures, Other","Ellen Page, Michael Cera, Jennifer Garner",95.0,90.0,48.0,20.33333333333333,68.33333333333333,184.66666666666663,12.0,2007.0,31.0
Meet the Robinsons (2007),6.9,76432,2007-03-30,95.0,153.0,173.0,61.0,150000000.0,25123781.0,97822171.0,169333034.0,USA,11.0,"Animation, Adventure, Comedy, Family, Sci-Fi",G,"Walt Disney Animation Studios, Walt Disney Pictures","Daniel Hansen, Wesley Singerman, Angela Bassett",10.0,1.0,61.0,30.0,91.0,277.0,3.0,2007.0,49.0
Shrek the Third (2007),6.0,240193,2007-05-18,93.0,335.0,224.0,58.0,160000000.0,121629270.0,320706665.0,798958162.0,USA,21.0,"Animation, Adventure, Comedy, Family, Fantasy",PG,"DreamWorks Animation, Pacific Data Images (PDI)","Mike Myers, Cameron Diaz, Eddie Murphy",16.0,5.0,66.0,29.66666666666667,95.66666666666669,334.3333333333333,5.0,2007.0,33.0
I Now Pronounce You Chuck & Larry (2007),6.0,129579,2007-07-20,115.0,234.0,169.0,37.0,85000000.0,34233750.0,120059556.0,186072214.0,USA,14.0,"Comedy, Romance",PG-13,"Universal Pictures, Relativity Media, Happy Madison Productions","Adam Sandler, Kevin James, Jessica Biel",14.0,0.0,38.333333333333336,19.666666666666668,58.0,270.0,7.0,2007.0,27.0
Across the Universe (2007),7.4,98936,2007-10-12,133.0,537.0,165.0,56.0,45000000.0,667784.0,24343673.0,29367143.0,USA,19.0,"Drama, Fantasy, Musical, Romance",PG-13,"Revolution Studios, Other, Team Todd","Evan Rachel Wood, Jim Sturgess, Joe Anderson",17.0,2.0,15.333333333333336,6.0,21.33333333333333,80.0,10.0,2007.0,51.0
The Bourne Ultimatum (2007),8.0,562338,2007-08-03,115.0,850.0,331.0,85.0,110000000.0,69283690.0,227471070.0,442824138.0,USA,68.0,"Action, Mystery, Thriller",PG-13,"Universal Pictures, Other, Kennedy/Marshall Company","Matt Damon, Edgar Ramírez, Joan Allen",39.0,29.0,72.0,26.33333333333333,98.33333333333331,216.66666666666663,8.0,2007.0,46.0
Aliens vs. Predator: Requiem (2007),4.7,103616,2007-12-25,94.0,1028.0,215.0,29.0,40000000.0,9515615.0,41797066.0,128884494.0,USA,4.0,"Action, Horror, Sci-Fi, Thriller",R,"Twentieth Century Fox, Davis Entertainment, Other","Reiko Aylesworth, Steven Pasquale, Shareeka Epps",4.0,0.0,7.5,2.0,9.5,24.5,12.0,2007.0,31.0
Rush Hour 3 (2007),6.2,135005,2007-08-10,91.0,224.0,167.0,44.0,140000000.0,49100158.0,140125968.0,258022233.0,USA,9.0,"Action, Comedy, Crime, Thriller",PG-13,"New Line Cinema, Other, Other","Jackie Chan, Chris Tucker, Max von Sydow",9.0,0.0,32.0,23.66666666666667,55.66666666666666,310.0,8.0,2007.0,46.0
Hostel: Part II (2007),5.5,77534,2007-06-08,94.0,393.0,242.0,46.0,10000000.0,8203391.0,17609452.0,35633963.0,USA,5.0,"Crime, Horror, Thriller",R,"Lionsgate, Screen Gems, Other","Lauren German, Heather Matarazzo, Bijou Phillips",5.0,0.0,3.6666666666666665,2.0,5.666666666666668,59.0,6.0,2007.0,40.0
National Treasure: Book of Secrets (2007),6.5,199072,2007-12-21,124.0,302.0,188.0,48.0,130000000.0,65444195.0,219964115.0,457364600.0,USA,6.0,"Action, Adventure, Family, Mystery, Thriller",PG,"Walt Disney Pictures, Jerry Bruckheimer Films, Other","Nicolas Cage, Diane Kruger, Justin Bartha",5.0,1.0,27.66666666666667,19.666666666666668,47.33333333333334,192.66666666666663,12.0,2007.0,31.0
3:10 to Yuma (2007),7.7,260253,2007-09-07,122.0,584.0,302.0,76.0,55000000.0,14035033.0,53606916.0,71171825.0,USA,35.0,"Action, Adventure, Crime, Drama, Western",R,"Lionsgate, Other, Relativity Media","Russell Crowe, Christian Bale, Ben Foster",32.0,3.0,61.66666666666666,36.333333333333336,98.0,208.66666666666663,9.0,2007.0,42.0
The Golden Compass (2007),6.1,161966,2007-12-07,113.0,679.0,253.0,51.0,180000000.0,25783232.0,70107728.0,346000000.0,UK,39.0,"Adventure, Family, Fantasy",PG-13,"New Line Cinema, Ingenious Film Partners, Other","Nicole Kidman, Daniel Craig, Dakota Blue Richards",32.0,7.0,104.5,51.5,156.0,343.0,12.0,2007.0,31.0
28 Weeks Later (2007),7.0,233351,2007-05-11,100.0,726.0,277.0,78.0,15000000.0,9807292.0,28638916.0,64238440.0,UK,15.0,"Drama, Horror, Sci-Fi",R,"Fox Atomic, DNA Films, UK Film Council","Jeremy Renner, Rose Byrne, Robert Carlyle",13.0,2.0,36.0,19.33333333333333,55.33333333333334,159.66666666666666,5.0,2007.0,33.0
Alvin and the Chipmunks (2007),5.2,65389,2007-12-14,92.0,148.0,130.0,39.0,60000000.0,44307417.0,217326974.0,361336633.0,USA,5.0,"Animation, Comedy, Family, Fantasy, Music",PG,"Fox 2000 Pictures, Regency Enterprises, Other","Jason Lee, Ross Bagdasarian Jr., Janice Karman",2.0,3.0,22.0,2.0,24.0,162.0,12.0,2007.0,31.0
Bee Movie (2007),6.1,120859,2007-11-02,91.0,254.0,188.0,54.0,150000000.0,38021044.0,126631277.0,287594577.0,USA,16.0,"Animation, Adventure, Comedy, Family",PG,"DreamWorks Animation, Other, Pacific Data Images (PDI)","Jerry Seinfeld, Renée Zellweger, Matthew Broderick",15.0,1.0,44.0,16.0,60.0,234.0,11.0,2007.0,44.0
Fantastic Four: Rise of the Silver Surfer (2007),5.6,230917,2007-06-15,92.0,451.0,260.0,45.0,130000000.0,58051684.0,131921738.0,289047763.0,USA,16.0,"Action, Adventure, Fantasy, Sci-Fi, Thriller",PG,"Twentieth Century Fox, Constantin Film, Marvel Studios","Ioan Gruffudd, Jessica Alba, Chris Evans",14.0,2.0,26.33333333333333,8.0,34.333333333333336,195.66666666666663,6.0,2007.0,40.0
The Simpsons Movie (2007),7.4,281088,2007-07-27,87.0,785.0,300.0,80.0,75000000.0,74036787.0,183135014.0,526745137.0,USA,39.0,"Animation, Adventure, Comedy",PG-13,"Twentieth Century Fox, Other, Other","Dan Castellaneta, Julie Kavner, Nancy Cartwright",34.0,5.0,25.0,5.0,30.0,104.0,7.0,2007.0,27.0
Hitman (2007),6.3,150071,2007-11-21,100.0,382.0,195.0,35.0,24000000.0,13180769.0,39687694.0,99965792.0,France,2.0,"Action, Crime, Drama, Thriller",R,"Twentieth Century Fox, EuropaCorp, Other","Timothy Olyphant, Dougray Scott, Olga Kurylenko",0.0,2.0,11.333333333333336,2.0,13.333333333333336,103.66666666666669,11.0,2007.0,44.0
We Own the Night (2007),6.9,77478,2007-10-12,117.0,203.0,216.0,59.0,21000000.0,10826287.0,28563179.0,54926886.0,USA,5.0,"Crime, Drama, Thriller",R,"Columbia Pictures, 2929 Productions, Industry Entertainment","Joaquin Phoenix, Mark Wahlberg, Eva Mendes",5.0,0.0,65.33333333333333,18.0,83.33333333333333,241.66666666666663,10.0,2007.0,51.0
30 Days of Night (2007),6.6,151252,2007-10-19,113.0,549.0,308.0,53.0,32000000.0,15951902.0,39568996.0,80276156.0,USA,13.0,"Horror, Thriller",R,"Columbia Pictures, Ghost House Pictures, Dark Horse Entertainment","Josh Hartnett, Melissa George, Danny Huston",13.0,0.0,12.666666666666664,3.333333333333333,16.0,107.66666666666669,10.0,2007.0,51.0
The Game Plan (2007),6.2,50441,2007-09-28,110.0,87.0,112.0,44.0,22000000.0,22950971.0,90648202.0,147880543.0,USA,3.0,"Comedy, Family, Sport",PG,"Walt Disney Pictures, Other, Other","Dwayne Johnson, Kyra Sedgwick, Madison Pettis",3.0,0.0,51.5,11.5,63.0,395.5,9.0,2007.0,42.0
The Orphanage (2007),7.5,132650,2008-01-11,105.0,321.0,305.0,74.0,3960705.1453054575,338024.0,7161284.0,79252330.0,Spain,73.0,"Drama, Horror, Mystery, Thriller",R,"Other, Other, Other","Belén Rueda, Fernando Cayo, Roger Príncep",41.0,32.0,19.0,11.0,30.0,169.0,1.0,2008.0,49.0
The Kingdom (2007),7.1,109457,2007-09-28,110.0,303.0,234.0,56.0,70000000.0,17135055.0,47536778.0,86658558.0,USA,5.0,"Action, Drama, Thriller",R,"Universal Pictures, Relativity Media, Other","Jamie Foxx, Chris Cooper, Jennifer Garner",5.0,0.0,57.66666666666666,31.33333333333333,89.0,283.3333333333333,9.0,2007.0,42.0
Charlie Wilson's War (2007),7.1,97053,2007-12-21,102.0,296.0,273.0,69.0,75000000.0,15952430.0,66661095.0,119000410.0,USA,28.0,"Biography, Comedy, Drama, History",R,"Universal Pictures, Relativity Media, Participant Media","Tom Hanks, Julia Roberts, Philip Seymour Hoffman",23.0,5.0,114.66666666666669,77.33333333333333,192.0,385.66666666666674,12.0,2007.0,31.0
Elizabeth: The Golden Age (2007),6.9,59831,2007-10-12,114.0,219.0,203.0,45.0,55000000.0,6153075.0,16285240.0,74870866.0,UK,35.0,"Biography, Drama, History, War",PG-13,"Universal Pictures, StudioCanal, Working Title Films","Cate Blanchett, Clive Owen, Geoffrey Rush",29.0,6.0,100.0,72.0,172.0,224.66666666666663,10.0,2007.0,51.0
Paranormal Activity (2007),6.3,201727,2009-10-16,86.0,1220.0,287.0,68.0,15000.0,77873.0,107918810.0,193355800.0,USA,15.0,"Horror, Mystery, Thriller",R,"Other, Blumhouse Productions","Katie Featherston, Micah Sloat, Mark Fredrichs",12.0,3.0,2.0,1.0,3.0,32.0,10.0,2009.0,47.0
The Darjeeling Limited (2007),7.2,157313,2007-10-26,91.0,298.0,277.0,67.0,17500000.0,134938.0,11902715.0,35076923.0,USA,8.0,"Adventure, Comedy, Drama",R,"Fox Searchlight Pictures, Other, Other","Owen Wilson, Adrien Brody, Jason Schwartzman",4.0,4.0,33.333333333333336,12.666666666666664,46.0,184.33333333333331,10.0,2007.0,51.0
Disturbia (2007),6.9,201296,2007-04-13,105.0,504.0,243.0,62.0,20000000.0,22224982.0,80209692.0,117760134.0,USA,10.0,"Drama, Mystery, Thriller",PG-13,"DreamWorks, Other, Montecito Picture Company","Shia LaBeouf, David Morse, Carrie-Anne Moss",6.0,4.0,21.66666666666667,7.666666666666668,29.33333333333333,152.0,4.0,2007.0,55.0
1408 (2007),6.8,233527,2007-06-22,104.0,600.0,308.0,64.0,25000000.0,20617667.0,71985628.0,131998242.0,USA,13.0,"Drama, Horror",PG-13,"Dimension Films, Weinstein Company, Di Bonaventura Pictures","John Cusack, Samuel L. Jackson, Mary McCormack",9.0,4.0,35.333333333333336,14.666666666666664,50.0,319.0,6.0,2007.0,40.0
Hannibal Rising (2007),6.2,94607,2007-02-09,121.0,408.0,111.0,35.0,50000000.0,13051650.0,27670986.0,82169884.0,UK,2.0,"Crime, Drama, Horror, Thriller, War",R,"Other, Other, Dino De Laurentiis Company","Gaspard Ulliel, Rhys Ifans, Li Gong",2.0,0.0,10.333333333333334,11.333333333333336,21.66666666666667,85.33333333333333,2.0,2007.0,36.0
Next (2007),6.2,135616,2007-04-27,96.0,318.0,189.0,42.0,70000000.0,7133049.0,18211013.0,77434049.0,USA,5.0,"Action, Sci-Fi, Thriller",PG-13,"Paramount Pictures, Revolution Studios, Initial Entertainment Group (IEG)","Nicolas Cage, Julianne Moore, Jessica Biel",3.0,2.0,81.0,53.66666666666666,134.66666666666666,272.0,4.0,2007.0,55.0
The Bucket List (2007),7.4,205892,2008-01-11,97.0,332.0,201.0,42.0,45000000.0,161840.0,93466502.0,175372502.0,USA,7.0,"Adventure, Comedy, Drama",PG-13,"Warner Bros., Other, Other","Jack Nicholson, Morgan Freeman, Sean Hayes",4.0,3.0,72.33333333333333,54.0,126.33333333333331,345.66666666666674,1.0,2008.0,49.0
Michael Clayton (2007),7.3,145098,2007-10-12,119.0,383.0,307.0,82.0,25000000.0,719910.0,49033882.0,92991835.0,USA,137.0,"Crime, Drama, Mystery, Thriller",R,"Other, Castle Rock Entertainment, Mirage Enterprises","George Clooney, Tilda Swinton, Tom Wilkinson",110.0,27.0,139.66666666666666,59.0,198.66666666666663,297.6666666666667,10.0,2007.0,51.0
License to Wed (2007),5.3,35075,2007-07-03,91.0,123.0,118.0,25.0,35000000.0,10422258.0,43799818.0,26824897.0,USA,1.0,"Comedy, Romance",PG-13,"Warner Bros., Village Roadshow Pictures, Robert Simonds Productions","Mandy Moore, John Krasinski, Robin Williams",1.0,0.0,41.66666666666666,26.0,67.66666666666667,351.33333333333326,7.0,2007.0,27.0
I'm Not There. (2007),7.0,51946,2007-12-07,135.0,234.0,235.0,73.0,20000000.0,730819.0,4017609.0,11664116.0,Germany,73.0,"Biography, Drama, Music, Western",R,"Killer Films, Other, Other","Christian Bale, Cate Blanchett, Heath Ledger",46.0,27.0,107.0,98.0,205.0,204.66666666666663,12.0,2007.0,31.0
Evan Almighty (2007),5.4,125474,2007-06-22,96.0,267.0,184.0,37.0,175000000.0,31192615.0,100462298.0,173418781.0,USA,13.0,"Comedy, Family, Fantasy",PG,"Universal Pictures, Spyglass Entertainment, Relativity Media","Steve Carell, Morgan Freeman, Lauren Graham",11.0,2.0,75.66666666666667,33.0,108.66666666666669,330.3333333333333,6.0,2007.0,40.0
Lars and the Real Girl (2007),7.3,126865,2007-11-02,106.0,313.0,222.0,70.0,12000000.0,90418.0,5972884.0,11293523.0,USA,40.0,"Comedy, Drama, Romance",PG-13,"Metro-Goldwyn-Mayer (MGM), Sidney Kimmel Entertainment, Other","Ryan Gosling, Emily Mortimer, Paul Schneider",33.0,7.0,54.33333333333334,13.666666666666664,68.0,122.33333333333331,11.0,2007.0,44.0
Epic Movie (2007),2.3,95541,2007-01-26,86.0,666.0,111.0,17.0,20000000.0,18612544.0,39739367.0,86865564.0,USA,5.0,"Adventure, Comedy",PG-13,"Regency Enterprises, New Regency Pictures, Other","Kal Penn, Jennifer Coolidge, Fred Willard",3.0,2.0,9.666666666666666,2.333333333333333,12.0,264.3333333333333,1.0,2007.0,42.0
Mr. Bean's Holiday (2007),6.4,100654,2007-08-24,90.0,243.0,151.0,56.0,25000000.0,9889780.0,33302167.0,229736344.0,UK,2.0,"Comedy, Family",G,"Universal Pictures, StudioCanal, Other","Rowan Atkinson, Willem Dafoe, Steve Pemberton",2.0,0.0,27.66666666666667,24.33333333333333,52.0,230.0,8.0,2007.0,46.0
The Heartbreak Kid (2007),5.8,77820,2007-10-05,116.0,184.0,171.0,46.0,60000000.0,14022105.0,36787257.0,127766650.0,USA,1.0,"Comedy, Romance",R,"DreamWorks, Radar Pictures, Davis Entertainment","Ben Stiller, Michelle Monaghan, Malin Akerman",0.0,1.0,23.0,5.666666666666668,28.66666666666667,266.3333333333333,10.0,2007.0,51.0
Dan in Real Life (2007),6.8,91766,2007-10-26,98.0,269.0,225.0,65.0,25000000.0,11809445.0,47636541.0,67938171.0,USA,4.0,"Comedy, Drama, Romance",PG-13,"Touchstone Pictures, Focus Features, Other","Steve Carell, Juliette Binoche, Dane Cook",4.0,0.0,61.33333333333334,23.33333333333333,84.66666666666667,238.0,10.0,2007.0,51.0
Vacancy (2007),6.2,86675,2007-04-20,85.0,318.0,222.0,54.0,19000000.0,7603376.0,19363565.0,35300645.0,USA,1.0,"Crime, Horror, Thriller",R,"Screen Gems, Other","Kate Beckinsale, Luke Wilson, Frank Whaley",1.0,0.0,14.0,7.666666666666668,21.66666666666667,159.66666666666666,4.0,2007.0,55.0
Saw IV (2007),5.9,125676,2007-10-26,93.0,335.0,198.0,36.0,10000000.0,31756764.0,63300095.0,139352633.0,USA,8.0,"Horror, Mystery, Thriller",R,Twisted Pictures,"Tobin Bell, Scott Patterson, Louis Ferreira",6.0,2.0,2.0,2.0,4.0,98.0,10.0,2007.0,51.0
Resident Evil: Extinction (2007),6.3,167508,2007-09-21,94.0,362.0,222.0,41.0,45000000.0,23678580.0,50648679.0,147717833.0,France,3.0,"Action, Horror, Sci-Fi, Thriller",R,"Screen Gems, Constantin Film, Davis-Films","Milla Jovovich, Ali Larter, Oded Fehr",1.0,2.0,8.333333333333334,2.333333333333333,10.666666666666666,119.0,9.0,2007.0,42.0
Freedom Writers (2007),7.5,59304,2007-01-05,123.0,236.0,83.0,64.0,21000000.0,9405582.0,36605602.0,43090741.0,Germany,3.0,"Biography, Crime, Drama",PG-13,"Paramount Pictures, Double Feature Films, MTV Films","Hilary Swank, Imelda Staunton, Patrick Dempsey",1.0,2.0,32.0,29.66666666666667,61.66666666666666,189.0,1.0,2007.0,42.0
Surf's Up (2007),6.7,59904,2007-06-08,85.0,118.0,154.0,64.0,100000000.0,17640249.0,58867694.0,149044513.0,USA,20.0,"Animation, Comedy, Family, Sport",PG,"Columbia Pictures, Sony Pictures Animation","Shia LaBeouf, Zooey Deschanel, Jon Heder",18.0,2.0,30.0,10.0,40.0,164.5,6.0,2007.0,40.0
Music and Lyrics (2007),6.5,88622,2007-02-14,95.0,294.0,172.0,59.0,40000000.0,15875471.0,50572589.0,145896422.0,USA,6.0,"Comedy, Music, Romance",PG-13,"Castle Rock Entertainment, Village Roadshow Pictures, Other","Hugh Grant, Drew Barrymore, Scott Porter",6.0,0.0,30.0,17.666666666666668,47.66666666666666,241.66666666666663,2.0,2007.0,36.0
Nancy Drew (2007),5.9,17491,2007-06-15,99.0,104.0,94.0,53.0,20000000.0,6832318.0,25612520.0,30666930.0,USA,7.0,"Comedy, Crime, Family, Mystery, Romance, Thriller",PG,"Warner Bros., Other, Jerry Weintraub Productions","Emma Roberts, Tate Donovan, Max Thieriot",7.0,0.0,13.0,4.0,17.0,109.66666666666669,6.0,2007.0,40.0
No Reservations (2007),6.3,64327,2007-07-27,104.0,136.0,171.0,50.0,28000000.0,11704357.0,43107979.0,92601050.0,USA,1.0,"Comedy, Drama, Romance",PG,"Castle Rock Entertainment, Other, Village Roadshow Pictures","Catherine Zeta-Jones, Aaron Eckhart, Abigail Breslin",1.0,0.0,27.66666666666667,16.666666666666668,44.33333333333334,156.0,7.0,2007.0,27.0
Reign Over Me (2007),7.5,88465,2007-03-23,124.0,236.0,153.0,61.0,20000000.0,7460690.0,19661987.0,1756556.0,USA,3.0,Drama,R,"Relativity Media, Other, Other","Adam Sandler, Don Cheadle, Jada Pinkett Smith",3.0,0.0,67.66666666666667,30.66666666666667,98.33333333333331,337.6666666666667,3.0,2007.0,49.0
Elite Squad (2007),8.1,89496,2007-10-12,115.0,113.0,144.0,33.0,4000000.0,3604.0,8060.0,14067078.0,Brazil,50.0,"Action, Crime, Drama, Thriller",R,"Other, Other, Other","Wagner Moura, André Ramiro, Caio Junqueira",11.0,39.0,12.0,15.5,27.5,53.5,10.0,2007.0,51.0
TMNT (2007),6.3,56943,2007-03-23,87.0,214.0,191.0,41.0,34000000.0,24255205.0,54149098.0,95608995.0,Hong Kong,2.0,"Animation, Action, Adventure, Comedy, Family, Fantasy, Sci-Fi",PG,"Other, Other, Other","Patrick Stewart, Mako, Chris Evans",2.0,0.0,29.33333333333333,8.333333333333334,37.66666666666666,262.0,3.0,2007.0,49.0
Shoot 'Em Up (2007),6.7,137212,2007-09-07,86.0,437.0,210.0,49.0,39000000.0,5716554.0,12807139.0,24096824.0,USA,3.0,"Action, Comedy, Crime, Thriller",R,"New Line Cinema, Other","Clive Owen, Monica Bellucci, Paul Giamatti",3.0,0.0,37.0,24.0,61.0,185.0,9.0,2007.0,42.0
Awake (2007),6.5,67936,2007-11-30,84.0,202.0,132.0,33.0,8600000.0,5856872.0,14377198.0,32685679.0,USA,4.0,"Crime, Drama, Mystery, Thriller",R,"Weinstein Company, GreeneStreet Films, Other","Hayden Christensen, Jessica Alba, Terrence Howard",3.0,1.0,38.0,19.0,57.0,220.0,11.0,2007.0,44.0
Perfect Stranger (2007),5.7,41019,2007-04-13,109.0,171.0,164.0,31.0,60795000.0,11500000.0,23984949.0,73090611.0,USA,1.0,"Crime, Drama, Horror, Mystery, Thriller",R,Revolution Studios,"Halle Berry, Bruce Willis, Giovanni Ribisi",0.0,1.0,46.33333333333334,22.66666666666667,69.0,318.3333333333333,4.0,2007.0,55.0
Mother of Tears (2007),5.1,7993,2007-10-31,102.0,108.0,182.0,52.0,3500000.0,19419.0,58669.0,3119957.0,Italy,1.0,"Drama, Horror, Thriller",R,"Medusa Film, Other, Myriad Pictures","Asia Argento, Cristian Solimeno, Adam James",1.0,0.0,14.0,16.0,30.0,156.0,10.0,2007.0,51.0
Becoming Jane (2007),7.1,52163,2007-08-10,120.0,153.0,152.0,55.0,16500000.0,972066.0,18670946.0,37311672.0,UK,9.0,"Biography, Drama, Romance",PG,"HanWay Films, UK Film Council, Bórd Scannán na hÉireann","Anne Hathaway, James McAvoy, Julie Walters",6.0,3.0,60.0,35.0,95.0,243.66666666666663,8.0,2007.0,46.0
Premonition (2007),5.9,67112,2007-03-16,96.0,348.0,142.0,29.0,20000000.0,17558689.0,47852604.0,84146832.0,USA,2.0,"Drama, Fantasy, Mystery, Thriller",PG-13,"TriStar Pictures, Metro-Goldwyn-Mayer (MGM), Hyde Park Entertainment","Sandra Bullock, Julian McMahon, Amber Valletta",2.0,0.0,39.333333333333336,25.33333333333333,64.66666666666667,152.66666666666666,3.0,2007.0,49.0
Rendition (2007),6.8,50745,2007-10-19,122.0,198.0,132.0,55.0,27500000.0,4060012.0,9736045.0,27038732.0,USA,3.0,"Drama, Thriller",R,"Anonymous Content, Other, Other","Reese Witherspoon, Jake Gyllenhaal, Peter Sarsgaard",2.0,1.0,76.66666666666667,34.666666666666664,111.33333333333331,224.33333333333331,10.0,2007.0,51.0
The Reaping (2007),5.7,39806,2007-04-05,99.0,184.0,188.0,36.0,40000000.0,10025203.0,25117498.0,62771059.0,USA,1.0,"Horror, Thriller",R,"Warner Bros., Dark Castle Entertainment, Other","Hilary Swank, David Morrissey, AnnaSophia Robb",1.0,0.0,18.666666666666668,20.666666666666668,39.333333333333336,137.66666666666666,4.0,2007.0,55.0
